{
    "format": "lnclass.schools",
    "version": 1,
    "drena": "abidjan-2",
    "schools": [
      { "name": "Lycée Classique d'Abidjan", "sigle": "LCA", "type": "public", "status": "active" },
      { "name": "Collège Notre Dame d'Afrique", "sigle": "CNDA", "type": "privée" },
      { "name": "Lycée Moderne de Man", "sigle": "LMM", "type": "public", "drena": "man" }
    ]
  }